ticker,date,title,content,source,url,sentiment_score,sentiment_label
TAN,2026-02-01,Japón desarrolla una tecnología revolucionaria que captura energía solar en el espacio y la transmite hacia la Tierra | Ciencia,Japón desarrolla una tecnología revolucionaria que captura energía solar en el espacio y la transmite hacia la Tierra | Ciencia,larepublica.pe,https://larepublica.pe/ciencia/2026/01/31/japon-desarrolla-una-tecnologia-revolucionaria-que-captura-energia-solar-en-el-espacio-y-la-transmite-hacia-la-tierra-2268611,0.09997532144188881,positive
TAN,2026-02-01,"기후부 , 산업용 전기요금 개편 … 야간 인상 vs 낮시간 인하","기후부 , 산업용 전기요금 개편 … 야간 인상 vs 낮시간 인하",newspim.com,https://www.newspim.com/news/view/20260201000050,0.0790770836174488,positive
TAN,2026-02-01,الطموح الأخضر 2026 .. مشروع الربط الكهربائي الذكي يمد مدن أوروبا بمستقبل مستدام,الطموح الأخضر 2026 .. مشروع الربط الكهربائي الذكي يمد مدن أوروبا بمستقبل مستدام,dostor.org,https://www.dostor.org/5403167,0.005429660901427269,neutral
TAN,2026-02-01,"Solarstrom , Euro , Fastenmonat – das bringt der Februar - Politik","Solarstrom , Euro , Fastenmonat – das bringt der Februar - Politik",pz-news.de,"https://www.pz-news.de/politik_artikel,-Solarstrom-Euro-Fastenmonat-das-bringt-der-Februar-_arid,2323368.html",0.041739391162991524,neutral
TAN,2026-01-31,Finanzmärkte 2026 : Chancen und Risiken für Anleger,Finanzmärkte 2026 : Chancen und Risiken für Anleger,deutsche-wirtschafts-nachrichten.de,https://deutsche-wirtschafts-nachrichten.de/718781/finanzmaerkte-2026-welche-risiken-anleger-beachten-muessen,0.08198874071240425,positive
TAN,2026-01-31,"Gautam Adani , nephew Sagar Adani , accept legal notice filed by US regulator after 15 months","Gautam Adani , nephew Sagar Adani , accept legal notice filed by US regulator after 15 months",india.com,https://www.india.com/business/gautam-adani-nephew-sagar-adani-accept-legal-notice-filed-by-us-regulator-after-15-months-to-hire-donald-trumps-lawyer-sec-new-york-court-agel-adani-group-robert-giuffra-jr-wall-street-8288251/,0.4280063490688801,positive
TAN,2026-01-31,Solar Stocks To Research – January 30th,Solar Stocks To Research – January 30th,dailypolitical.com,https://www.dailypolitical.com/2026/01/31/solar-stocks-to-research-january-30th.html,0.0028185201808810234,neutral
TAN,2026-01-31,"Gujarat contributes 16 . 50 % to India renewable energy , cumulative installations reaches 42 . 583 GW","Gujarat contributes 16 . 50 % to India renewable energy , cumulative installations reaches 42 . 583 GW",aninews.in,https://aninews.in/news/national/general-news/gujarat-contributes-1650-to-indias-renewable-energy-cumulative-installations-reaches-42583-gw20260131183140/,0.38713824484050274,positive
TAN,2026-01-31,中国欢迎世贸要求美取消清洁能源补贴措施,中国欢迎世贸要求美取消清洁能源补贴措施,zaobao.com.sg,https://www.zaobao.com.sg/finance/china/story20260131-8242247,0.0596489030867815,positive
TAN,2026-01-31,Çinde Yenilenebilir Enerji Toplam Enerji Üretim Kapasitesinin Yüzde 60  ını Aştı,Çinde Yenilenebilir Enerji Toplam Enerji Üretim Kapasitesinin Yüzde 60  ını Aştı,haberler.com,https://www.haberler.com/guncel/cin-de-yenilenebilir-enerji-kullanimi-artiyor-19521352-haberi/,0.012188728898763657,neutral
TAN,2026-01-31,海南州清洁能源装机容量与发电量双领跑 _ 央广网,海南州清洁能源装机容量与发电量双领跑 _ 央广网,cnr.cn,https://www.cnr.cn/qhfw/gstjqh/20260131/t20260131_527511461.shtml,0.03912621736526489,neutral
TAN,2026-01-31,GEA receives six bids for installation of solar carports,GEA receives six bids for installation of solar carports,kaieteurnewsonline.com,https://kaieteurnewsonline.com/2026/01/31/gea-receives-six-bids-for-installation-of-solar-carports/,0.07284053135663271,positive
TAN,2026-01-31,Кто может получить деньги на генератор для дома - как получить деньги,Кто может получить деньги на генератор для дома - как получить деньги,glavred.info,https://glavred.info/economics/kto-mozhet-poluchit-dengi-na-generator-dlya-doma-kak-poluchit-pomoshch-ot-gosudarstva-10736792.html,0.07039819192141294,positive
TAN,2026-01-31,WTO裁定美清洁能源补贴违规有何意义 凸显多边规则制约作用 _ 新闻频道 _ 中华网,WTO裁定美清洁能源补贴违规有何意义 凸显多边规则制约作用 _ 新闻频道 _ 中华网,news.china.com,https://news.china.com/socialgd/10000169/20260131/49213599.html,0.026480093598365784,neutral
TAN,2026-01-31,Za več sončnih elektrarn je nujno dinamično upravljanje,Za več sončnih elektrarn je nujno dinamično upravljanje,delo.si,https://www.delo.si/gospodarstvo/novice/za-vec-soncnih-elektrarn-je-nujno-dinamicno-upravljanje,0.038358334451913834,neutral
TAN,2026-01-30,Solar Stocks To Research – January 30th,Solar Stocks To Research – January 30th,tickerreport.com,https://www.tickerreport.com/banking-finance/13331148/solar-stocks-to-research-january-30th.html,0.0028185201808810234,neutral
TAN,2026-01-30,731亿元赋能新赛道 ， 凉山全力打造空天与绿能融合发展的  造梦中心  |卫星|凉山州|商业航天,731亿元赋能新赛道 ， 凉山全力打造空天与绿能融合发展的  造梦中心  |卫星|凉山州|商业航天,163.com,https://www.163.com/dy/article/KKI3VCC4051492T3.html,0.22909535467624664,positive
TAN,2026-01-30,Iki birželio galite susižerti tūkstančius šiems įrenginiams : skyrė papildomų pinigų,Iki birželio galite susižerti tūkstančius šiems įrenginiams : skyrė papildomų pinigų,lrytas.lt,https://www.lrytas.lt/verslas/rinkos-pulsas/2026/01/30/news/iki-birzelio-galite-susizerti-tukstancius-siems-irenginiams-skyre-papildomu-pinigu-41155276,0.010111700743436813,neutral
TAN,2026-01-30,新筑股份资产整合收成效 预计2025年同比大幅减亏,新筑股份资产整合收成效 预计2025年同比大幅减亏,stcn.com,https://www.stcn.com/article/detail/3622886.html,0.08584348857402802,positive
TAN,2026-01-30,Iki birželio galite susižerti tūkstančius šiems įrenginiams : skyrė papildomų pinigų,Iki birželio galite susižerti tūkstančius šiems įrenginiams : skyrė papildomų pinigų,lrytas.lt,https://www.lrytas.lt/verslas/rinkos-pulsas/2026/01/30/news/iki-birzelio-galite-susizerti-tukstancius-siems-irenginiams-skyre-papildomu-pinigu-41155276/,0.010111700743436813,neutral
TAN,2026-01-30,光莆股份 ： 营收规模稳健增长 ， 深化光集成传感器战略布局,光莆股份 ： 营收规模稳健增长 ， 深化光集成传感器战略布局,stcn.com,https://www.stcn.com/article/detail/3622823.html,0.04338701814413071,neutral
TAN,2026-01-30,"Mumbai Railway Vikas Corporation To Install Large - Scale Solar Power Systems At Mira Road , Virar , Palghar And Neral Stations","Mumbai Railway Vikas Corporation To Install Large - Scale Solar Power Systems At Mira Road , Virar , Palghar And Neral Stations",freepressjournal.in,https://www.freepressjournal.in/mumbai/mumbai-railway-vikas-corporation-to-install-large-scale-solar-power-systems-at-mira-road-virar-palghar-and-neral-stations,0.07321179332211614,positive
TAN,2026-01-30,"GS건설 · LG유플러스 , 신재생에너지직접 전력구매계약 공급확대 MOU","GS건설 · LG유플러스 , 신재생에너지직접 전력구매계약 공급확대 MOU",biz.heraldcorp.com,https://biz.heraldcorp.com/article/10666286,0.024757524952292442,neutral
TAN,2026-01-30,  绿电  卖全球 ， 标准通未来 杭州临平区绿色能源产业发展加速,  绿电  卖全球 ， 标准通未来 杭州临平区绿色能源产业发展加速,baijiahao.baidu.com,https://baijiahao.baidu.com/s?id=1855696896015847531,0.04092722199857235,neutral
TAN,2026-01-30,太阳能点亮海岛村落 （ 第一现场 ） -- 国际 -- 人民网,太阳能点亮海岛村落 （ 第一现场 ） -- 国际 -- 人民网,world.people.com.cn,https://world.people.com.cn/n1/2026/0130/c1002-40655767.html,0.04246207978576422,neutral
TAN,2026-01-30,"Verbraucher : Solarstrom , Euro , Fastenmonat – das bringt der Februar - Politik","Verbraucher : Solarstrom , Euro , Fastenmonat – das bringt der Februar - Politik",rnz.de,"https://www.rnz.de/politik/nachrichten_artikel,-Verbraucher-Solarstrom-Euro-Fastenmonat-das-bringt-der-Februar-_arid,1937830.html",0.02627398492768407,neutral
TAN,2026-01-30,Our Favorite Portable Power Station from Anker is over 40 % off : Deal of the Day,Our Favorite Portable Power Station from Anker is over 40 % off : Deal of the Day,nbcnews.com,https://www.nbcnews.com/select/shopping/favorite-portable-power-station-anker-40-deal-day-rcna256565,0.43623452471792695,positive
TAN,2026-01-30,Macomb Dream Home : Romeo has plenty of space and cost savings built in,Macomb Dream Home : Romeo has plenty of space and cost savings built in,macombdaily.com,https://www.macombdaily.com/2026/01/29/macomb-dream-home-romeo-has-plenty-of-space-and-cost-savings-built-in/,0.597409788993001,positive
TAN,2026-01-30,"INPEX JAPAN , Mitsuuroko Green Energy to form JV in electricity sector","INPEX JAPAN , Mitsuuroko Green Energy to form JV in electricity sector",trend.az,https://www.trend.az/business/energy/4147808.html,0.34710147140845654,positive
TAN,2026-01-30,日产给电车装上太阳能板 ： 每天晒晒太阳就能多跑23公里 ！ ,日产给电车装上太阳能板 ： 每天晒晒太阳就能多跑23公里 ！ ,finance.sina.com.cn,https://finance.sina.com.cn/tech/roll/2026-01-30/doc-inhizxrr3756225.shtml,0.04358302243053913,neutral
TAN,2026-01-30,Индустриализация и зеленая энергетика : утвержден план действий Кабинета министров на 2026 год Tazabek,Индустриализация и зеленая энергетика : утвержден план действий Кабинета министров на 2026 год Tazabek,tazabek.kg,https://www.tazabek.kg/news:2405502,0.04823853261768818,neutral
TAN,2026-01-30,  绿电  卖全球 ， 标准通未来 杭州临平区绿色能源产业发展加速,  绿电  卖全球 ， 标准通未来 杭州临平区绿色能源产业发展加速,baijiahao.baidu.com,https://baijiahao.baidu.com/s?id=1855696579675658404,0.04092722199857235,neutral
TAN,2026-01-30,Japanese team explores green energy ties with Uttar Pradesh,Japanese team explores green energy ties with Uttar Pradesh,economictimes.indiatimes.com,https://economictimes.indiatimes.com/news/india/japanese-team-explores-green-energy-ties-with-uttar-pradesh/articleshow/127791855.cms,0.36641350344121454,positive
TAN,2026-01-30,"LGU+ , 서초IDC 포함 6개 사옥 전력  재생에너지  로 전환","LGU+ , 서초IDC 포함 6개 사옥 전력  재생에너지  로 전환",ddaily.co.kr,https://www.ddaily.co.kr:443/page/view/2026013010015395320,0.029472494963556528,neutral
TAN,2026-01-30,Утвержден План действий Кабинета Министров на 2026 год,Утвержден План действий Кабинета Министров на 2026 год,knews.kg,https://knews.kg/2026/01/30/utverzhden-plan-dejstvij-kabineta-ministrov-na-2026-god/,0.2860090071335435,positive
TAN,2026-01-30,太阳能点亮海岛村落 （ 第一现场 ） ,太阳能点亮海岛村落 （ 第一现场 ） ,163.com,https://www.163.com/dy/article/KKGRDL5D0514R9M0.html,0.025025784969329834,neutral
TAN,2026-01-30,Solar Supercapacitor Lamp Probably Wont Get You Saved At Sea,Solar Supercapacitor Lamp Probably Wont Get You Saved At Sea,hackaday.com,https://hackaday.com/2026/01/29/solar-supercapacitor-lamp-probably-wont-get-you-saved-at-sea/,-0.33027807428240774,negative
TAN,2026-01-30,"Solarstrom , Euro , Fastenmonat – das bringt der Februar","Solarstrom , Euro , Fastenmonat – das bringt der Februar",gn-online.de,https://www.gn-online.de/deutschland-und-welt/solarstrom-euro-fastenmonat-das-bringt-der-februar-600120.html,0.041872753761708736,neutral
TAN,2026-01-30,"Solarstrom , Euro , Fastenmonat – das bringt der Februar","Solarstrom , Euro , Fastenmonat – das bringt der Februar",t-online.de,https://www.t-online.de/nachrichten/deutschland/id_101106742/solarstrom-euro-fastenmonat-das-bringt-der-februar.html,0.041872753761708736,neutral
TAN,2026-01-30,"LGU+ , GS건설과 데이터센터 탄소중립 위한 재생에너지 계약 체결","LGU+ , GS건설과 데이터센터 탄소중립 위한 재생에너지 계약 체결",biz.heraldcorp.com,https://biz.heraldcorp.com/article/10666059,0.028895249590277672,neutral
TAN,2026-01-30,雷曼光电 ： 持续拓展Micro LED显示应用场景,雷曼光电 ： 持续拓展Micro LED显示应用场景,finance.sina.com.cn,https://finance.sina.com.cn/tech/roll/2026-01-30/doc-inhizxrt0687972.shtml,0.033690039068460464,neutral
TAN,2026-01-30,HTHIY Stock Price Quote | Morningstar,HTHIY Stock Price Quote | Morningstar,morningstar.com,https://www.morningstar.com/stocks/pinx/hthiy/quote,-0.011541762389242649,neutral
TAN,2026-01-30,杭州临平区绿色能源产业发展加速 - 新华网,杭州临平区绿色能源产业发展加速 - 新华网,zj.xinhuanet.com,http://www.zj.xinhuanet.com/20260130/01ac90978e6547a581f958522ea818eb/c.html,0.010289294645190239,neutral
TAN,2026-01-30,"Solarstrom , Euro , Fastenmonat – das bringt der Februar - Nachrichten aus Deutschland","Solarstrom , Euro , Fastenmonat – das bringt der Februar - Nachrichten aus Deutschland",zvw.de,https://www.zvw.de/mehr-nachrichten/deutschland/solarstrom-euro-fastenmonat-das-bringt-der-februar_arid-1049021,0.03795514442026615,neutral
TAN,2026-01-29,Is Nextpower Stock a Buy Now ? | The Motley Fool,Is Nextpower Stock a Buy Now ? | The Motley Fool,fool.com,https://www.fool.com/investing/2026/01/29/is-nextpower-stock-a-buy-now/?source=iedfolrf0000001,-0.4244982105076313,negative
TAN,2026-01-29,UNU - INRA calls for resilient systems to support Africa clean energy transition,UNU - INRA calls for resilient systems to support Africa clean energy transition,myjoyonline.com,https://www.myjoyonline.com/unu-inra-calls-for-resilient-systems-to-support-africas-clean-energy-transition/,0.6640655343554914,positive
TAN,2026-01-29,Power Grid Services Market Is Going to Massive Growth by 2033,Power Grid Services Market Is Going to Massive Growth by 2033,openpr.com,https://www.openpr.com/news/4369398/power-grid-services-market-is-going-to-massive-growth-by-2033,0.7734112029984593,positive
TAN,2026-01-29,JinkoSolar Aktie : Hoher Milliardenverlust () ,JinkoSolar Aktie : Hoher Milliardenverlust () ,aktiencheck.de,https://www.aktiencheck.de/analysen/Artikel-JinkoSolar_Aktie_Hoher_Milliardenverlust-19415705,0.000403430312871933,neutral
TAN,2026-01-29,"Gold und Silber sind so teuer wie nie , verschiedene Faktoren wirken","Gold und Silber sind so teuer wie nie , verschiedene Faktoren wirken",finanznachrichten.de,https://www.finanznachrichten.de/nachrichten-2026-01/67558513-gold-und-silber-sind-so-teuer-wie-nie-verschiedene-faktoren-wirken-413.htm,0.037485248409211636,neutral
TAN,2026-01-29,Кулеба рассказал подробности программы СветоДом,Кулеба рассказал подробности программы СветоДом,korrespondent.net,https://korrespondent.net/ukraine/4851245-kuleba-rasskazal-podrobnosty-prohrammy-svetodom,0.0855546873062849,positive
TAN,2026-01-29,  Clean Energy for People and Planet  must start with African realities,  Clean Energy for People and Planet  must start with African realities,dailymaverick.co.za,https://www.dailymaverick.co.za/article/clean-energy-for-people-and-planet-must-start-with-african-realities/,0.46911800390779973,positive
TAN,2026-01-29,Kakšne pogoje plavajoči elektrarni postavlja šoštanjski župan ? ,Kakšne pogoje plavajoči elektrarni postavlja šoštanjski župan ? ,vecer.com,https://vecer.com/celjsko/kaksne-pogoje-plavajoci-elektrarni-postavlja-sostanjski-zupan-10404240,-0.019139636307954788,neutral
TAN,2026-01-29,"Nigeria : JMG Drives Clean Energy Conversation , Showcases  Scalable  Solar Solutions","Nigeria : JMG Drives Clean Energy Conversation , Showcases  Scalable  Solar Solutions",allafrica.com,https://allafrica.com/stories/202601290277.html,0.5195346387460829,positive
TAN,2026-01-29,Кулеба розповів подробиці програми СвітлоДім,Кулеба розповів подробиці програми СвітлоДім,ua.korrespondent.net,https://ua.korrespondent.net/ukraine/4851245-kuleba-rozpoviv-podrobytsi-prohramy-svitlodim,0.028195200487971306,neutral
TAN,2026-01-29,"У Кабміні заявили , що спростили процедури встановлення сонячних електростанцій на будівлях","У Кабміні заявили , що спростили процедури встановлення сонячних електростанцій на будівлях",nikvesti.com,https://nikvesti.com/news/public/314149-u-kabmini-zaiavili-scho-sprostili-protsedury-vstanovlennia-soniachnykh-elektrostantsii-na-budivliakh,0.13613601867109537,positive
TAN,2026-01-29,新天绿能 ( 600956 ): 新天绿能2025年第四季度主要经营数据公告 - CFi . CN 中财网,新天绿能 ( 600956 ): 新天绿能2025年第四季度主要经营数据公告 - CFi . CN 中财网,cfi.net.cn,http://www.cfi.net.cn/p20260129002258.html,-0.3948802650824189,negative
TAN,2026-01-29,В Україні спростили встановлення сонячних електростанцій на будівлях,В Україні спростили встановлення сонячних електростанцій на будівлях,dengi.ua,https://dengi.ua/ua/suspilstvo/9758681-v-ukrayini-sprostili-vstanovlennya-sonyachnikh-elektrostantsij-na-budivlyakh,0.05386633612215519,positive
TAN,2026-01-29,JinkoSolar Aktie : Hoher Milliardenverlust () ,JinkoSolar Aktie : Hoher Milliardenverlust () ,aktiencheck.de,https://www.aktiencheck.de/news/Artikel-JinkoSolar_Aktie_Hoher_Milliardenverlust-19415705,0.000403430312871933,neutral
TAN,2026-01-29,Gutterres Says It Time To Switch To Clean Energy Goals,Gutterres Says It Time To Switch To Clean Energy Goals,cleantechnica.com,https://cleantechnica.com/2026/01/29/gutterres-says-its-time-to-switch-to-clean-energy-goals/,0.5156418575786055,positive
TAN,2026-01-29,"Economic Survey FY26 : Energy transition should align with growth , security , institutional preparedness","Economic Survey FY26 : Energy transition should align with growth , security , institutional preparedness",economictimes.indiatimes.com,https://economictimes.indiatimes.com/industry/renewables/economic-survey-fy26-energy-transition-should-align-with-growth-security-institutional-preparedness/articleshow/127767894.cms,0.5230927875876427,positive
TAN,2026-01-29,我国风电太阳能发电累计装机首超18亿千瓦,我国风电太阳能发电累计装机首超18亿千瓦,finance.sina.com.cn,https://finance.sina.com.cn/tech/roll/2026-01-29/doc-inhixqkh3352361.shtml,0.02974081039428711,neutral
TAN,2026-01-29,Clean Kinetics : A regional solar powerhouse,Clean Kinetics : A regional solar powerhouse,straitstimes.com,https://www.straitstimes.com/business/41-fold-growth-in-revenue-solar-power-renewable-energy-clean-kinetics,0.4706918954074383,positive
TAN,2026-01-29,Nissan : Η ηλιακή ενέργεια μπορεί να κινήσει το μέλλον,Nissan : Η ηλιακή ενέργεια μπορεί να κινήσει το μέλλον,newsbeast.gr,https://www.newsbeast.gr/car/arthro/12856879/nissan-i-iliaki-energeia-borei-na-kinisei-to-mellon,0.015502500347793102,neutral
TAN,2026-01-29,Cisco Expands European Renewable Energy Through Partnership with R . Power S . A . in Poland Facilitated by SR Inc NZCB,Cisco Expands European Renewable Energy Through Partnership with R . Power S . A . in Poland Facilitated by SR Inc NZCB,prnewswire.com,http://www.prnewswire.com/news-releases/cisco-expands-european-renewable-energy-through-partnership-with-rpower-sa-in-poland-facilitated-by-sr-incs-nzcb-302672702.html,0.7773038614120334,positive
TAN,2026-01-29,Suomeen suunnitellaan 30 000 hehtaaria lis aurinkovoimaa – Stara . fi,Suomeen suunnitellaan 30 000 hehtaaria lis aurinkovoimaa – Stara . fi,stara.fi,https://www.stara.fi/2026/01/29/suomeen-suunnitellaan-30-000-hehtaaria-lisaa-aurinkovoimaa/,-0.006959265097975731,neutral
TAN,2026-01-29,科技巨頭搶電大戰 ！ 特斯拉轉型力拱綠能 … 00899今年漲幅17 . 51 ％ 完勝大盤 | 存股族愛ETF | 股市,科技巨頭搶電大戰 ！ 特斯拉轉型力拱綠能 … 00899今年漲幅17 . 51 ％ 完勝大盤 | 存股族愛ETF | 股市,udn.com,https://udn.com/news/story/123006/9296558,-0.013993017375469208,neutral
TAN,2026-01-29,В Україні спростили правила встановлення сонячних електростанцій на дахах,В Україні спростили правила встановлення сонячних електростанцій на дахах,ua.korrespondent.net,https://ua.korrespondent.net/ukraine/4851123-v-ukraini-sprostyly-pravyla-vstanovlennia-soniachnykh-elektrostantsii-na-dakhakh,0.07562961988151073,positive
TAN,2026-01-29,投影+餐饮融合 ！ 极米科技供应商 ， 迅达光电成为西贝集团股东,投影+餐饮融合 ！ 极米科技供应商 ， 迅达光电成为西贝集团股东,finance.sina.com.cn,https://finance.sina.com.cn/tech/roll/2026-01-29/doc-inhixqke4377413.shtml,0.04853729158639908,neutral
TAN,2026-01-29,中国去年新增风能和太阳能装机创纪录,中国去年新增风能和太阳能装机创纪录,zaobao.com.sg,https://www.zaobao.com.sg/news/china/story20260129-8208944,0.0492984801530838,neutral
TAN,2026-01-29,90天贯通中试线 ！ 微玖光电以产业加速度斩获近亿元融资,90天贯通中试线 ！ 微玖光电以产业加速度斩获近亿元融资,stcn.com,https://www.stcn.com/article/detail/3619200.html,0.04002862796187401,neutral
TAN,2026-01-29,中國科學家研發新方法 提升鈣鈦礦太陽能電池效率至 26 . 6 % ,中國科學家研發新方法 提升鈣鈦礦太陽能電池效率至 26 . 6 % ,hk.news.yahoo.com,https://hk.news.yahoo.com/%E4%B8%AD%E5%9C%8B%E7%A7%91%E5%AD%B8%E5%AE%B6%E7%A0%94%E7%99%BC%E6%96%B0%E6%96%B9%E6%B3%95-%E6%8F%90%E5%8D%87%E9%88%A3%E9%88%A6%E7%A4%A6%E5%A4%AA%E9%99%BD%E8%83%BD%E9%9B%BB%E6%B1%A0%E6%95%88%E7%8E%87%E8%87%B3-26-6-020036542.html,0.010612145066261292,neutral
TAN,2026-01-28,Кабмін забезпечить дітей з інвалідністю зарядними станціями та спростив встановлення СЕС,Кабмін забезпечить дітей з інвалідністю зарядними станціями та спростив встановлення СЕС,interfax.com.ua,https://interfax.com.ua/news/general/1140256.html,0.06760202907025814,positive
TAN,2026-01-28,Уряд спростив процедури встановлення сонячних електростанцій на будівлях,Уряд спростив процедури встановлення сонячних електростанцій на будівлях,epravda.com.ua,https://epravda.com.ua/biznes/uryad-sprostiv-proceduri-vstanovlennya-sonyachnih-elektrostanciy-na-budivlyah-817238/,0.0686013475060463,positive
TAN,2026-01-28,Кабмін забезпечить дітей з інвалідністю зарядними станціями та спростив встановлення СЕС,Кабмін забезпечить дітей з інвалідністю зарядними станціями та спростив встановлення СЕС,ua.interfax.com.ua,https://ua.interfax.com.ua/news/general/1140256.html,0.06760202907025814,positive
TAN,2026-01-28,"Inox Clean Energy raises ₹3 , 400 crore from NaBFID to refinance Vibrant Energy debt","Inox Clean Energy raises ₹3 , 400 crore from NaBFID to refinance Vibrant Energy debt",economictimes.indiatimes.com,https://economictimes.indiatimes.com/industry/renewables/inox-clean-energy-raises-3400-crore-from-nabfid-to-refinance-vibrant-energy-debt/articleshow/127729733.cms,0.9267940760761499,positive
TAN,2026-01-28,Preisexplosion bei Solaranlagen ? China schafft Steuervergünstigungen ab,Preisexplosion bei Solaranlagen ? China schafft Steuervergünstigungen ab,agrarheute.com,https://www.agrarheute.com/energie/preisexplosion-solaranlagen-china-schafft-steuerverguenstigungen-ab-638822,0.005444299429655075,neutral
TAN,2026-01-28,Best Solar Stocks To Follow Now – January 25th,Best Solar Stocks To Follow Now – January 25th,dailypolitical.com,https://www.dailypolitical.com/2026/01/28/best-solar-stocks-to-follow-now-january-25th.html,0.48965191076397896,positive
TAN,2026-01-28,CleanChoice Energy CEO Tom Matzzie Recognized on 2026 MO 100 Top Impact CEO Ranking for Driving Meaningful Social and Environmental Progress,CleanChoice Energy CEO Tom Matzzie Recognized on 2026 MO 100 Top Impact CEO Ranking for Driving Meaningful Social and Environmental Progress,manilatimes.net,https://www.manilatimes.net/2026/01/28/tmt-newswire/globenewswire/cleanchoice-energy-ceo-tom-matzzie-recognized-on-2026-mo-100-top-impact-ceo-ranking-for-driving-meaningful-social-and-environmental-progress/2267091,0.7796572353675961,positive
TAN,2026-01-28,Azerbaijan and European companies explore green energy partnership,Azerbaijan and European companies explore green energy partnership,trend.az,https://www.trend.az/business/energy/4147184.html,0.40337943660393355,positive
